{
  "$schema": "https://json-schema.org/draft/2020-12/schema",
  "$id": "https://rewireperform.local/contracts/feedback-intelligence/staging-privilege-audit-v0.2/result.schema.json",
  "title": "Feedback Intelligence metadata-only Staging privilege audit result v0.2",
  "type": "object",
  "additionalProperties": false,
  "required": [
    "schema_version",
    "contract_status",
    "project_ref",
    "executed_at",
    "database_name_redacted",
    "audit_phase",
    "data_access",
    "evidence"
  ],
  "properties": {
    "schema_version": {
      "const": "rewireperform-feedback-intelligence-staging-privilege-audit-result-v2"
    },
    "contract_status": {
      "const": "METADATA_ONLY_UNSIGNED_NOT_ACTIVATED"
    },
    "project_ref": {
      "const": "zbeswjipayspgvcipzmx"
    },
    "executed_at": {
      "type": "string",
      "minLength": 20
    },
    "database_name_redacted": {
      "const": true
    },
    "audit_phase": {
      "enum": [
        "PREDEPLOY_BASELINE",
        "POSTDEPLOY_ASSURANCE"
      ]
    },
    "data_access": {
      "type": "object",
      "additionalProperties": false,
      "required": [
        "catalog_metadata_only",
        "application_rows_read",
        "application_functions_called",
        "database_mutated"
      ],
      "properties": {
        "catalog_metadata_only": {
          "const": true
        },
        "application_rows_read": {
          "const": false
        },
        "application_functions_called": {
          "const": false
        },
        "database_mutated": {
          "const": false
        }
      }
    },
    "evidence": {
      "type": "object",
      "additionalProperties": false,
      "required": [
        "reader_role",
        "reader_memberships",
        "gateway_function",
        "internal_export_function",
        "gateway_execute_matrix",
        "machine_export_functions",
        "denied_role_machine_paths",
        "reader_callable_functions",
        "reader_relation_privileges",
        "reader_sequence_privileges",
        "reader_schema_usage",
        "public_execute_defaults"
      ],
      "properties": {
        "reader_role": {
          "oneOf": [
            {
              "type": "object",
              "additionalProperties": false,
              "required": [
                "present"
              ],
              "properties": {
                "present": {
                  "const": false
                }
              }
            },
            {
              "type": "object",
              "additionalProperties": false,
              "required": [
                "present",
                "superuser",
                "inherit",
                "create_role",
                "create_db",
                "can_login",
                "replication",
                "bypass_rls",
                "database_connect"
              ],
              "properties": {
                "present": {
                  "const": true
                },
                "superuser": {
                  "type": "boolean"
                },
                "inherit": {
                  "type": "boolean"
                },
                "create_role": {
                  "type": "boolean"
                },
                "create_db": {
                  "type": "boolean"
                },
                "can_login": {
                  "type": "boolean"
                },
                "replication": {
                  "type": "boolean"
                },
                "bypass_rls": {
                  "type": "boolean"
                },
                "database_connect": {
                  "type": "boolean"
                }
              }
            }
          ]
        },
        "reader_memberships": {
          "type": "array",
          "items": {
            "type": "object",
            "additionalProperties": false,
            "required": [
              "member_name",
              "granted_role",
              "grantor_name",
              "admin_option",
              "inherit_option",
              "set_option"
            ],
            "properties": {
              "member_name": {
                "type": "string"
              },
              "granted_role": {
                "type": "string"
              },
              "grantor_name": {
                "type": "string"
              },
              "admin_option": {
                "type": "boolean"
              },
              "inherit_option": {
                "type": "boolean"
              },
              "set_option": {
                "type": "boolean"
              }
            }
          }
        },
        "gateway_function": {
          "oneOf": [
            {
              "type": "object",
              "additionalProperties": false,
              "required": [
                "present"
              ],
              "properties": {
                "present": {
                  "const": false
                }
              }
            },
            {
              "type": "object",
              "additionalProperties": false,
              "required": [
                "present",
                "signature",
                "security_definer",
                "function_settings",
                "owner_name",
                "owner_superuser",
                "owner_bypass_rls",
                "return_type",
                "volatility",
                "definition_sha256"
              ],
              "properties": {
                "present": {
                  "const": true
                },
                "signature": {
                  "const": "public.read_feedback_intelligence_v0_2_draft(text, text, text, text)"
                },
                "security_definer": {
                  "const": true
                },
                "function_settings": {
                  "type": "array",
                  "prefixItems": [
                    {
                      "const": "search_path=\"\""
                    }
                  ],
                  "items": false,
                  "minItems": 1,
                  "maxItems": 1
                },
                "owner_name": {
                  "const": "postgres"
                },
                "owner_superuser": {
                  "const": false
                },
                "owner_bypass_rls": {
                  "const": true
                },
                "return_type": {
                  "const": "jsonb"
                },
                "volatility": {
                  "const": "VOLATILE"
                },
                "definition_sha256": {
                  "const": "0d617fcb5e5a7ece31ca94b7ff0cf07026712b0d9ed4206c95bee9f4b198a8af"
                }
              }
            }
          ]
        },
        "gateway_execute_matrix": {
          "oneOf": [
            {
              "type": "object",
              "additionalProperties": false,
              "required": [
                "anon",
                "authenticated",
                "service_role"
              ],
              "properties": {
                "anon": {
                  "type": "boolean"
                },
                "authenticated": {
                  "type": "boolean"
                },
                "service_role": {
                  "type": "boolean"
                }
              }
            },
            {
              "type": "object",
              "additionalProperties": false,
              "required": [
                "anon",
                "authenticated",
                "mahleos_feedback_reader",
                "service_role"
              ],
              "properties": {
                "anon": {
                  "type": "boolean"
                },
                "authenticated": {
                  "type": "boolean"
                },
                "mahleos_feedback_reader": {
                  "type": "boolean"
                },
                "service_role": {
                  "type": "boolean"
                }
              }
            }
          ]
        },
        "machine_export_functions": {
          "type": "array",
          "items": {
            "$ref": "#/$defs/machineFunctionEvidence"
          }
        },
        "denied_role_machine_paths": {
          "type": "array",
          "items": {
            "$ref": "#/$defs/deniedPath"
          }
        },
        "reader_callable_functions": {
          "type": "array",
          "items": {
            "$ref": "#/$defs/readerFunctionEvidence"
          }
        },
        "reader_relation_privileges": {
          "type": "array",
          "items": {
            "$ref": "#/$defs/relationPrivilege"
          }
        },
        "reader_sequence_privileges": {
          "type": "array",
          "items": {
            "$ref": "#/$defs/sequencePrivilege"
          }
        },
        "reader_schema_usage": {
          "type": "array",
          "items": {
            "enum": [
              "public",
              "feedback_core",
              "feedback_consent",
              "feedback_raw",
              "feedback_analysis"
            ]
          },
          "uniqueItems": true
        },
        "public_execute_defaults": {
          "type": "array",
          "items": {
            "type": "object",
            "additionalProperties": false,
            "required": [
              "owner_name",
              "source"
            ],
            "properties": {
              "owner_name": {
                "type": "string"
              },
              "source": {
                "enum": [
                  "BUILT_IN_DEFAULT",
                  "ALTERED_DEFAULT"
                ]
              }
            }
          }
        },
        "internal_export_function": {
          "oneOf": [
            {
              "type": "object",
              "additionalProperties": false,
              "required": [
                "present"
              ],
              "properties": {
                "present": {
                  "const": false
                }
              }
            },
            {
              "type": "object",
              "additionalProperties": false,
              "required": [
                "present",
                "signature",
                "security_definer",
                "function_settings",
                "owner_name",
                "owner_superuser",
                "owner_bypass_rls",
                "return_type",
                "volatility",
                "definition_sha256"
              ],
              "properties": {
                "present": {
                  "const": true
                },
                "signature": {
                  "const": "feedback_analysis.export_feedback_intelligence_v0_2_internal(text, text, text, text)"
                },
                "security_definer": {
                  "const": true
                },
                "function_settings": {
                  "type": "array",
                  "prefixItems": [
                    {
                      "const": "search_path=\"\""
                    }
                  ],
                  "items": false,
                  "minItems": 1,
                  "maxItems": 1
                },
                "owner_name": {
                  "const": "postgres"
                },
                "owner_superuser": {
                  "const": false
                },
                "owner_bypass_rls": {
                  "const": true
                },
                "return_type": {
                  "const": "jsonb"
                },
                "volatility": {
                  "const": "VOLATILE"
                },
                "definition_sha256": {
                  "const": "89420ddf3f79ad57538f4fb1ad56458717874490ddbc88b52d577e081d3e872f"
                }
              }
            }
          ]
        }
      }
    }
  },
  "$defs": {
    "readerFunctionEvidence": {
      "type": "object",
      "additionalProperties": false,
      "required": [
        "schema_name",
        "function_name",
        "identity_arguments",
        "security_definer",
        "owner_name"
      ],
      "properties": {
        "schema_name": {
          "enum": [
            "public",
            "feedback_core",
            "feedback_consent",
            "feedback_raw",
            "feedback_analysis"
          ]
        },
        "function_name": {
          "type": "string"
        },
        "identity_arguments": {
          "type": "string"
        },
        "security_definer": {
          "type": "boolean"
        },
        "owner_name": {
          "type": "string"
        }
      }
    },
    "machineFunctionEvidence": {
      "type": "object",
      "additionalProperties": false,
      "required": [
        "schema_name",
        "function_name",
        "identity_arguments",
        "owner_name",
        "security_definer",
        "function_settings",
        "return_type",
        "volatility",
        "definition_sha256"
      ],
      "properties": {
        "schema_name": {
          "enum": [
            "public",
            "feedback_core",
            "feedback_consent",
            "feedback_raw",
            "feedback_analysis"
          ]
        },
        "function_name": {
          "type": "string"
        },
        "identity_arguments": {
          "type": "string"
        },
        "owner_name": {
          "type": "string"
        },
        "security_definer": {
          "type": "boolean"
        },
        "function_settings": {
          "type": "array",
          "items": {
            "type": "string"
          },
          "uniqueItems": true
        },
        "return_type": {
          "type": "string"
        },
        "volatility": {
          "enum": [
            "IMMUTABLE",
            "STABLE",
            "VOLATILE"
          ]
        },
        "definition_sha256": {
          "type": "string",
          "pattern": "^[a-f0-9]{64}$"
        }
      }
    },
    "deniedPath": {
      "type": "object",
      "additionalProperties": false,
      "required": [
        "subject_role",
        "schema_name",
        "function_name",
        "identity_arguments",
        "owner_name",
        "security_definer",
        "function_settings",
        "return_type",
        "volatility",
        "definition_sha256"
      ],
      "properties": {
        "subject_role": {
          "enum": [
            "PUBLIC",
            "anon",
            "authenticated",
            "service_role"
          ]
        },
        "schema_name": {
          "enum": [
            "public",
            "feedback_core",
            "feedback_consent",
            "feedback_raw",
            "feedback_analysis"
          ]
        },
        "function_name": {
          "type": "string"
        },
        "identity_arguments": {
          "type": "string"
        },
        "owner_name": {
          "type": "string"
        },
        "security_definer": {
          "type": "boolean"
        },
        "function_settings": {
          "type": "array",
          "items": {
            "type": "string"
          },
          "uniqueItems": true
        },
        "return_type": {
          "type": "string"
        },
        "volatility": {
          "enum": [
            "IMMUTABLE",
            "STABLE",
            "VOLATILE"
          ]
        },
        "definition_sha256": {
          "type": "string",
          "pattern": "^[a-f0-9]{64}$"
        }
      }
    },
    "relationPrivilege": {
      "type": "object",
      "additionalProperties": false,
      "required": [
        "schema_name",
        "relation_name",
        "relkind",
        "privilege_type"
      ],
      "properties": {
        "schema_name": {
          "enum": [
            "public",
            "feedback_core",
            "feedback_consent",
            "feedback_raw",
            "feedback_analysis"
          ]
        },
        "relation_name": {
          "type": "string"
        },
        "relkind": {
          "enum": [
            "r",
            "p",
            "v",
            "m"
          ]
        },
        "privilege_type": {
          "enum": [
            "SELECT",
            "INSERT",
            "UPDATE",
            "DELETE",
            "TRUNCATE",
            "REFERENCES",
            "TRIGGER"
          ]
        }
      }
    },
    "sequencePrivilege": {
      "type": "object",
      "additionalProperties": false,
      "required": [
        "schema_name",
        "relation_name",
        "privilege_type"
      ],
      "properties": {
        "schema_name": {
          "enum": [
            "public",
            "feedback_core",
            "feedback_consent",
            "feedback_raw",
            "feedback_analysis"
          ]
        },
        "relation_name": {
          "type": "string"
        },
        "privilege_type": {
          "enum": [
            "USAGE",
            "SELECT",
            "UPDATE"
          ]
        }
      }
    }
  }
}
