{
  "schema_version": "rewireperform-feedback-intelligence-staging-privilege-audit-result-v2",
  "contract_status": "METADATA_ONLY_UNSIGNED_NOT_ACTIVATED",
  "project_ref": "zbeswjipayspgvcipzmx",
  "executed_at": "2026-08-08T10:00:00.000+00:00",
  "database_name_redacted": true,
  "audit_phase": "POSTDEPLOY_ASSURANCE",
  "data_access": {
    "catalog_metadata_only": true,
    "application_rows_read": false,
    "application_functions_called": false,
    "database_mutated": false
  },
  "evidence": {
    "reader_role": {
      "present": true,
      "superuser": false,
      "inherit": false,
      "create_role": false,
      "create_db": false,
      "can_login": true,
      "replication": false,
      "bypass_rls": false,
      "database_connect": true
    },
    "reader_memberships": [
      {
        "member_name": "postgres",
        "granted_role": "mahleos_feedback_reader",
        "grantor_name": "supabase_admin",
        "admin_option": true,
        "inherit_option": false,
        "set_option": false
      }
    ],
    "gateway_function": {
      "present": true,
      "signature": "public.read_feedback_intelligence_v0_2_draft(text, text, text, text)",
      "security_definer": true,
      "function_settings": [
        "search_path=\"\""
      ],
      "owner_name": "postgres",
      "owner_superuser": false,
      "owner_bypass_rls": true,
      "return_type": "jsonb",
      "volatility": "VOLATILE",
      "definition_sha256": "0d617fcb5e5a7ece31ca94b7ff0cf07026712b0d9ed4206c95bee9f4b198a8af"
    },
    "gateway_execute_matrix": {
      "anon": false,
      "authenticated": false,
      "mahleos_feedback_reader": true,
      "service_role": false
    },
    "machine_export_functions": [
      {
        "schema_name": "feedback_analysis",
        "function_name": "export_feedback_intelligence_v0_2_internal",
        "identity_arguments": "text, text, text, text",
        "owner_name": "postgres",
        "security_definer": true,
        "function_settings": [
          "search_path=\"\""
        ],
        "return_type": "jsonb",
        "volatility": "VOLATILE",
        "definition_sha256": "89420ddf3f79ad57538f4fb1ad56458717874490ddbc88b52d577e081d3e872f"
      },
      {
        "schema_name": "public",
        "function_name": "read_feedback_intelligence_v0_2_draft",
        "identity_arguments": "text, text, text, text",
        "owner_name": "postgres",
        "security_definer": true,
        "function_settings": [
          "search_path=\"\""
        ],
        "return_type": "jsonb",
        "volatility": "VOLATILE",
        "definition_sha256": "0d617fcb5e5a7ece31ca94b7ff0cf07026712b0d9ed4206c95bee9f4b198a8af"
      }
    ],
    "denied_role_machine_paths": [],
    "reader_callable_functions": [
      {
        "schema_name": "public",
        "function_name": "read_feedback_intelligence_v0_2_draft",
        "identity_arguments": "text, text, text, text",
        "security_definer": true,
        "owner_name": "postgres"
      }
    ],
    "reader_relation_privileges": [],
    "reader_sequence_privileges": [],
    "reader_schema_usage": [
      "public"
    ],
    "public_execute_defaults": [],
    "internal_export_function": {
      "present": true,
      "signature": "feedback_analysis.export_feedback_intelligence_v0_2_internal(text, text, text, text)",
      "security_definer": true,
      "function_settings": [
        "search_path=\"\""
      ],
      "owner_name": "postgres",
      "owner_superuser": false,
      "owner_bypass_rls": true,
      "return_type": "jsonb",
      "volatility": "VOLATILE",
      "definition_sha256": "89420ddf3f79ad57538f4fb1ad56458717874490ddbc88b52d577e081d3e872f"
    }
  }
}
