{
  "schema_version": "rewireperform-feedback-intelligence-staging-privilege-audit-result-v2",
  "contract_status": "METADATA_ONLY_UNSIGNED_NOT_ACTIVATED",
  "project_ref": "zbeswjipayspgvcipzmx",
  "executed_at": "2026-08-08T10:00:00.000+00:00",
  "database_name_redacted": true,
  "audit_phase": "PREDEPLOY_BASELINE",
  "data_access": {
    "catalog_metadata_only": true,
    "application_rows_read": false,
    "application_functions_called": false,
    "database_mutated": false
  },
  "evidence": {
    "reader_role": {
      "present": false
    },
    "reader_memberships": [],
    "gateway_function": {
      "present": false
    },
    "gateway_execute_matrix": {
      "anon": false,
      "authenticated": false,
      "service_role": false
    },
    "machine_export_functions": [],
    "denied_role_machine_paths": [],
    "reader_callable_functions": [],
    "reader_relation_privileges": [],
    "reader_sequence_privileges": [],
    "reader_schema_usage": [],
    "public_execute_defaults": [
      {
        "owner_name": "postgres",
        "source": "BUILT_IN_DEFAULT"
      }
    ],
    "internal_export_function": {
      "present": false
    }
  }
}
